{
  "schema_version": "1.0.0",
  "artifact_type": "rerun_comparison",
  "contract_id": "ctr-example",
  "run_id": "run-example",
  "performed_at": "2026-01-01T00:00:00Z",
  "tolerance_used": 0.000001,
  "comparisons": [
    {
      "comparison_id": "cmp-primary-result",
      "baseline_artifact_id": "artifact-primary-result",
      "rerun_uri": "results/rerun-primary-result.tsv",
      "metric": "max_absolute_difference",
      "observed_difference": 0.0
    }
  ],
  "extensions": {}
}
